"Абиссинская кошка","Неугомонная абиссинская кошка жить не может без внимания хозяина. Она будет бегать за ним во время уборки, помогать набирать текст на клавиатуре, обязательно попробует самостоятельно открыть дверь комнаты и, конечно, уложит его вещи так, как считает нужным. И сама заберется сверху. В общем, если в вашем доме поселилась задорная абиссинка, забудьте о степенном возлежании на диване. Лучше запаситесь игрушками.<br /><img itemprop=""photo"" title=""Абиссинская кошка"" style=""border-top: 0px; border-right: 0px; background-image: none; border-bottom: 0px; float: none; padding-top: 0px; padding-left: 0px; margin-left: auto; border-left: 0px; display: block; padding-right: 0px; margin-right: auto"" border=""0"" alt=""Абиссинская кошка"" src=""C:\Users\verych\Documents\DataThief\images\b53dfbeac6d1b5261f13935c6c618a9e.jpeg"" width=""600"" height=""400"" /><br />flickr/peterned<br />Считается, что она произошла от дикой африканской кошки, которая когда-то обитала на территории Абиссинии (современная Эфиопия). В 1868 году британский капитан Баррет-Ленард привез первого абиссинского кота из военной экспедиции. Звали красавца Зула. Именно он стал родоначальником породы. Правда, первые абиссинские кошки еще не были похожи на современных. Допускалось множество окрасов, да и их форма тела в то время была совсем другой.<br /><br /><img itemprop=""photo"" title=""Абиссинская кошка"" style=""border-top: 0px; border-right: 0px; background-image: none; border-bottom: 0px; float: none; padding-top: 0px; padding-left: 0px; margin-left: auto; border-left: 0px; display: block; padding-right: 0px; margin-right: auto"" border=""0"" alt=""Абиссинская кошка"" src=""C:\Users\verych\Documents\DataThief\images\3ff1897604082921d1c9f71ec2ed26cd.jpeg"" width=""600"" height=""364"" /><br />flickr/Abysphere<br />Официально зарегистрировали породу только в 1904 году, а спустя три года пара серебристых абиссинских красавиц отправилась в Америку. Во время войны многие породы животных чуть было не исчезли, и абиссинская кошечка не стала исключением. Второе рождение в Европе она получила уже после окончания второй мировой войны с помощью американских заводчиков.<br /><img itemprop=""photo"" title=""Абиссинская кошка"" style=""border-top: 0px; border-right: 0px; background-image: none; border-bottom: 0px; float: none; padding-top: 0px; padding-left: 0px; margin-left: auto; border-left: 0px; display: block; padding-right: 0px; margin-right: auto"" border=""0"" alt=""Абиссинская кошка"" src=""C:\Users\verych\Documents\DataThief\images\812404a0fa457484534b2bf619738c7a.jpeg"" width=""600"" height=""415"" /><br />flickr/Abysphere<br />Главное украшение абиссинской кошки – это ее шерсть. Короткая и блестящая, она переливается разными цветами. А все благодаря тикингу: каждый волосок на теле абиссинки имеет сразу несколько оттенков. <br /><img itemprop=""photo"" title=""Абиссинская кошка"" style=""border-top: 0px; border-right: 0px; background-image: none; border-bottom: 0px; float: none; padding-top: 0px; padding-left: 0px; margin-left: auto; border-left: 0px; display: block; padding-right: 0px; margin-right: auto"" border=""0"" alt=""Абиссинская кошка"" src=""C:\Users\verych\Documents\DataThief\images\25d0980840175c022037be8fc188de91.jpeg"" width=""600"" height=""371"" /><br />flickr/peter_hasselbom<br />Официально признано четыре окраса:<br /><br />Фавн (fawn) – фон насыщенного цвета слоновой кости с тикингом бежево-розового оттенка;<br />Голубой (blue) – абрикосовый фон с серо-голубым тикингом;<br />Соррель (sorrel, cynnamon, red) – яркий абрикосовый фон с тикингом цвета корицы;<br />Дикий (ruddy, usual) – черный тикинг на теплом красновато-коричневом фоне. <br /><br />Есть еще два варианта: шоколадный и лиловый, но они признаются не во всех клубах. <br /><img itemprop=""photo"" title=""Абиссинская кошка"" style=""border-top: 0px; border-right: 0px; background-image: none; border-bottom: 0px; float: none; padding-top: 0px; padding-left: 0px; margin-left: auto; border-left: 0px; display: block; padding-right: 0px; margin-right: auto"" border=""0"" alt=""Абиссинская кошка"" src=""C:\Users\verych\Documents\DataThief\images\7f635377670840b48b73fef1cca626e9.jpeg"" width=""600"" height=""785"" /><br />flickr/Abysphere<br />У этой кошечки стройное гибкое тело, треугольная голова с округлой мордашкой и большие смешные уши с кисточками. Миндалевидные глаза абиссинки с красивым зеленым, янтарным или ореховым оттенком не могут не очаровать любого, кто только попробует в них заглянуть. Кажется, что прячутся в них лукавство и неуемное озорство, которые так и просятся наружу.<br /><img itemprop=""photo"" title=""Абиссинская кошка"" style=""border-top: 0px; border-right: 0px; background-image: none; border-bottom: 0px; float: none; padding-top: 0px; padding-left: 0px; margin-left: auto; border-left: 0px; display: block; padding-right: 0px; margin-right: auto"" border=""0"" alt=""Абиссинская кошка"" src=""C:\Users\verych\Documents\DataThief\images\b4ce0ba158a2cb994f3079d4afeb661e.jpeg"" width=""600"" height=""371"" /><br />flickr/peter_hasselbom<br />И правда: стоит абиссинке что-то задумать, как она это тут же воплощает в жизнь. Забраться на верхнюю полку и спрыгнуть оттуда под ноги хозяину? Запросто! Устроить беспричинный и бессмысленный забег по квартире? Почему бы и нет! Или просто подставить свой очаровательный носик под поцелуи хозяйки? Держите, мне не жалко.<br /><img itemprop=""photo"" title=""Абиссинская кошка"" style=""border-top: 0px; border-right: 0px; background-image: none; border-bottom: 0px; float: none; padding-top: 0px; padding-left: 0px; margin-left: auto; border-left: 0px; display: block; padding-right: 0px; margin-right: auto"" border=""0"" alt=""Абиссинская кошка"" src=""C:\Users\verych\Documents\DataThief\images\d273d7e9bf623df59c7e1adc39d709d8.jpeg"" width=""600"" height=""398"" /><br />flickr/Abysphere<br />Главное, что нужно знать при общении с абиссинцами — они остро нуждаются в ласке хозяина. Если вы только что пришли домой, лучше сразу уделите своей красавице немного внимания, иначе она будет привлекать его другим способом. Почесать за ухом, спросить, как прошел день (да-да, абиссинки любят «поговорить»!) или просто угостить чем-нибудь вкусненьким — и ваша любимица тут же забудет все свои горести.<br /><img itemprop=""photo"" title=""Абиссинская кошка"" style=""border-top: 0px; border-right: 0px; background-image: none; border-bottom: 0px; float: none; padding-top: 0px; padding-left: 0px; margin-left: auto; border-left: 0px; display: block; padding-right: 0px; margin-right: auto"" border=""0"" alt=""Абиссинская кошка"" src=""C:\Users\verych\Documents\DataThief\images\981d950060757f64deb93feda27ec723.jpeg"" width=""600"" height=""397"" /><br />flickr/Abysphere<br />Ухаживать за кошками абиссинской породы несложно. Ее шерсть не нужно регулярно вычесывать: достаточно раз в неделю чистить ее рукой – так она будет гораздо больше переливаться. Можно купить щетку с частыми зубьями или шелковую ткань: с помощью этих нехитрых приспособлений можно сделать шубку абиссинки еще красивее.<br /><img itemprop=""photo"" title=""Абиссинская кошка"" style=""border-top: 0px; border-right: 0px; background-image: none; border-bottom: 0px; float: none; padding-top: 0px; padding-left: 0px; margin-left: auto; border-left: 0px; display: block; padding-right: 0px; margin-right: auto"" border=""0"" alt=""Абиссинская кошка"" src=""C:\Users\verych\Documents\DataThief\images\a8de8343b4024d71cbf13ad5a51cd393.jpeg"" width=""600"" height=""600"" /><br />flickr/peter_hasselbom<br />В остальном все, как обычно: сбалансированный рацион, регулярные нагрузки (чаще играйте с кошкой) и забота об ушах и когтях – вот и все премудрости. Позаботьтесь о наличии когтеточки и места для сна, если вы не планируете укладывать ее себе в постель. Хотя… Разве ее удержишь? В жаркое время следите за наличием воды в ее мисочке и старайтесь обеспечить в квартире прохладу, а в холодное – закройте чем-нибудь батарею, иначе абиссинка непременно уляжется на нее.<br /> <br />Если вам удалось купить кота или кошку абиссинской породы, пожалуйста оставьте Ваш отзыв в комментариях. Другие, не менее удивительные породы кошек с фотографиями, ждут вас на отдельной странице !","http://www.zoopicture.ru/abissinskaya-koshka/","2017-03-16 12:03:31",
"Американский керл","История американского керла начинается с… доброты. В 1981 году семья фермеров из Южной Калифорнии приютила у себя кошечку с довольно странными ушками. Грейс и Джо Руга (так звали новых хозяев счастливицы) просто пожалели уличную бродяжку и поселили ее у себя. Назвали найденыша Суламифь (в честь красавицы, воспетой царем Соломоном). Вскоре кошечка отблагодарила своих спасителей, как могла, родив им четверых котят.<br /><img itemprop=""photo"" title=""Американский керл"" style=""border-left-width: 0px; border-right-width: 0px; border-bottom-width: 0px; float: none; margin-left: auto; display: block; border-top-width: 0px; margin-right: auto"" border=""0"" alt=""Американский керл"" src=""C:\Users\verych\Documents\DataThief\images\dbc4644bfafb88f3f623c8faa4cb145e.jpeg"" width=""500"" height=""384"" /><br />ЖЖ/tessochka<br />И осталась бы эта история неизвестной, если бы у двоих из малышей на четвертый день не начали загибаться назад ушки. Точно так же, как и у их необычной мамы. И тогда хозяева Шу (ласковое от Суламифь) поняли, что имеют дело с генетической особенностью, которая может послужить основой для создания новой породы. Подросших малышей они раздали знакомым, которые согласились заняться разведением котят с забавными ушками.<br /><br /><br /><img itemprop=""photo"" title=""Американский керл"" style=""border-left-width: 0px; border-right-width: 0px; border-bottom-width: 0px; float: none; margin-left: auto; display: block; border-top-width: 0px; margin-right: auto"" border=""0"" alt=""Американский керл"" src=""C:\Users\verych\Documents\DataThief\images\7898f52b06ea0dcb78f190737d75ea32.jpeg"" width=""500"" height=""350"" /><br />ЖЖ/tessochka<br />Первое время было тяжело, так как заводчики еще ничего не знали об американских керлах. Вскоре они обнаружили, что все потомство от родителей с загнутыми ушами наследует особенность родителей. А вот если пара смешанная (мама керл, папа обычный и наоборот), то минимум половина котят (иногда больше) наследуют загнутые ушки. Правда, проявляется это только на 4-й день и окончательно закрепляется к 4-му месяцу. Именно тогда и можно судить о «качестве» кошки: домашняя, племенная или выставочная.<br /><img itemprop=""photo"" title=""Американский керл"" style=""border-left-width: 0px; border-right-width: 0px; border-bottom-width: 0px; float: none; margin-left: auto; display: block; border-top-width: 0px; margin-right: auto"" border=""0"" alt=""Американский керл"" src=""C:\Users\verych\Documents\DataThief\images\e571300c3352856e09de4ce4847cbeb0.jpeg"" width=""500"" height=""366"" /><br />ЖЖ/tessochka<br />Любопытно, что угол загиба ушек никак не зависит от родителей. У кошек со слабым загибом могут появиться котята шоу-класса и наоборот. Обычно угол разворота у американских керлов не меньше 90 градусов, хотя у некоторых экземпляров он доходит до 180 градусов. При этом самыми оптимальными считаются 135 градусов.<br /><img itemprop=""photo"" title=""Американский керл"" style=""border-left-width: 0px; border-right-width: 0px; border-bottom-width: 0px; float: none; margin-left: auto; display: block; border-top-width: 0px; margin-right: auto"" border=""0"" alt=""Американский керл"" src=""C:\Users\verych\Documents\DataThief\images\f4296fac0b8e1b328302200356c7bf41.jpeg"" width=""500"" height=""334"" /><br />ЖЖ/tessochka<br />Официальный дебют американских керлов состоялся в 1983 году на выставке в Палм Стринг, а в 2002 году они были признаны международной организацией Fife. Сегодня порода наиболее популярна на своей родине – в США. В других странах мира они остаются редкостью. А зря! Ведь американские керлы не только очаровательные, но и довольно ласковые и сообразительные существа.<br /><img itemprop=""photo"" title=""Американский керл"" style=""border-left-width: 0px; border-right-width: 0px; border-bottom-width: 0px; float: none; margin-left: auto; display: block; border-top-width: 0px; margin-right: auto"" border=""0"" alt=""Американский керл"" src=""C:\Users\verych\Documents\DataThief\images\f4bcf50fbaff98b8481e65526b75d59b.jpeg"" width=""500"" height=""366"" /><br />ЖЖ/tessochka<br />Отличительной чертой американских керлов считаются, безусловно, их ушки. В остальном стандарт породы довольно демократичен. Допускаются любые окрасы: колорпойнт, табби, черепаховые однотонные, серебристые и дымные и т. д. При этом глаза не должны сочетаться с окрасом животного, исключение составляет только колорпойнт, который требует голубых глаз. Керлы могут быть короткошерстными или полудлиношерстными, причем вторые более популярны.<br /><img itemprop=""photo"" title=""Американский керл"" style=""border-left-width: 0px; border-right-width: 0px; border-bottom-width: 0px; float: none; margin-left: auto; display: block; border-top-width: 0px; margin-right: auto"" border=""0"" alt=""Американский керл"" src=""C:\Users\verych\Documents\DataThief\images\a1ae5b86ed6a08da00bf9d73f06909b6.jpeg"" width=""500"" height=""366"" /><br />ЖЖ/tessochka<br />Что касается характера, то тут сказывается хорошее воспитание всех представителей породы. Американские керлы послушные и непривередливые животные, которые быстро привыкают ко всем домочадцам. Если в семье есть совсем маленькие дети, стоит сразу показать им, как обращаться с котенком, так как чувствительные ушки керлов могут травмироваться от грубого обращения.<br /><br />Американские керлы внимательно следят за хозяевами, стараясь участвовать во всех их действиях. Они проберутся за вами в ванную и обязательно устроятся рядом, пока вы будете принимать душ. Они улягутся вам на колени и будут довольно урчать, пока вы будете бродить по интересным сайтам. При этом керлы «неразговорчивы»: громкому «мяу» они предпочитают тихое воркование в ответ на ваши слова. Такие вот интеллигентные создания.<br />Другие, не менее удивительные породы кошек с фотографиями, ждут вас на отдельной странице !","http://www.zoopicture.ru/amerikanskij-kerl/","2017-03-16 13:26:51",
